"TwitterID","TwitterLink","Datum","TweetText","BildLink","Name"
"1157546641668227073","https://twitter.com/datGestruepp/status/1157546641668227073","03.08.2019","Da ist schon wieder ein Pokémon in meine Kaffee!","http://pbs.twimg.com/media/EAuiNnGW4AAxQIO.jpg","Tangela (Pokemon, Game)"
"1157909029538029569","https://twitter.com/datGestruepp/status/1157909029538029569","04.08.2019","Entschuldigung? Sind sie immer so kalt?","http://pbs.twimg.com/media/EAuiavmW4AAtODB.jpg","Eiskaltes Händchen (Addams Family)"
"1158271417621843968","https://twitter.com/datGestruepp/status/1158271417621843968","05.08.2019","Ach, die will nur spielen!","http://pbs.twimg.com/media/EAuiqGDWwAEBEyo.jpg","Luxo Junior (Pixar Lampe)"
"1158633805613273090","https://twitter.com/datGestruepp/status/1158633805613273090","06.08.2019","Sie mögen Äpfel?","http://pbs.twimg.com/media/EAui-B-WkAAzGN-.jpg","Ryuk (bzw seine Hand und Apfel) (Death Note)"
"1158996194313625600","https://twitter.com/datGestruepp/status/1158996194313625600","07.08.2019","Ähm... ja... hallo?","http://pbs.twimg.com/media/EAujL6kWkAEY1qa.jpg","Stewie Griffin (Family Guy)"
"1159339900996587521","https://twitter.com/datGestruepp/status/1159339900996587521","08.08.2019","Ich habe einen Kaffee den sie nicht ablehnen können.","http://pbs.twimg.com/media/EBbNfUgXoAAP73w.jpg","Der Pate"
"1159705870617501696","https://twitter.com/datGestruepp/status/1159705870617501696","09.08.2019","Aaah ich muss ganz dringend.... ich hab da einen Bogen und...","http://pbs.twimg.com/media/EBdF_sVXkAA_lBD.jpg","Ghast (Minecraft, Game)"
"1160068738596638721","https://twitter.com/datGestruepp/status/1160068738596638721","10.08.2019","Ihr seid ja gar nicht grün! Hahahahaaa... ha .... ha... lustig weil Frösche und so. Ha! ... okay ich geh ja schon zurück in die Säuremine.","http://pbs.twimg.com/media/EBlkXhOXUAEHQJo.jpg","Rick und Steve (Space Frogs)"
"1160430646109646848","https://twitter.com/datGestruepp/status/1160430646109646848","11.08.2019","Awwww! Sie sind so niedlich wenn sie klein sind!","http://pbs.twimg.com/media/EBn0ndqWkAA9FJF.jpg","Piranha-Pflanze (Mario, Nintendo, Game)"
"1160793032947404801","https://twitter.com/datGestruepp/status/1160793032947404801","12.08.2019","Ich bin ein Murch...!","http://pbs.twimg.com/media/EBsAVkrX4AEabcH.jpg","Buchling (Das Labyrinth der träumenden Bücher, Walter Moers, Buch)"
"1161147871204237312","https://twitter.com/datGestruepp/status/1161147871204237312","13.08.2019","Hallo! Wie geht‘s dem Baby?","http://pbs.twimg.com/media/EByJrqPXsAAaY86.jpg","Hasemann und Herr Meckerich (@studio_vieleck auf Twitter)"
"1161517809374916608","https://twitter.com/datGestruepp/status/1161517809374916608","14.08.2019","Kaffee Kaffee Kaffee Kaffeeeeeeeeee!!","http://pbs.twimg.com/media/EB3X6XnWwAASJ9x.jpg","Koffe-in und Koffein-frei (Grasbüschel mit Kaffee)"
"1161880198142451713","https://twitter.com/datGestruepp/status/1161880198142451713","15.08.2019","Schon wach?","http://pbs.twimg.com/media/EB7OV22XUAAAUSJ.jpg","Mona der Vampir (Zeichentrick)"
"1162242586591092736","https://twitter.com/datGestruepp/status/1162242586591092736","16.08.2019","Äh, wer?","http://pbs.twimg.com/media/EB_ooA0XkAA6edd.jpg","Aang (Avatar the last Airbender, Zeichentrick)"
"1162604974934618118","https://twitter.com/datGestruepp/status/1162604974934618118","17.08.2019","Ach, dich hab ich doch schon mal irgendwo gesehen!","http://pbs.twimg.com/media/EB_pSRaXsAAftct.jpg","Marvin der Marsmensch (Comic, Chuck Jones)"
"1162967360585654272","https://twitter.com/datGestruepp/status/1162967360585654272","18.08.2019","Sie sind Proffessor.... aha...","http://pbs.twimg.com/media/ECJaBqQWwAE19_f.jpg","Prof. Bienlein (Tim und Struppi, Hérgé)"
"1163329748048719872","https://twitter.com/datGestruepp/status/1163329748048719872","19.08.2019","Wie wär‘s mit einem Luftballontier! Gnihihi!","http://pbs.twimg.com/media/ECLXQheXoAAt_uD.jpg","The Mask / Die Maske"
"1163692135838654464","https://twitter.com/datGestruepp/status/1163692135838654464","20.08.2019","Guten Morgen!","http://pbs.twimg.com/media/ECLZmMVXkAAvQ1b.jpg","Mona Suse (Tribut an Leonardo DaVinci, Mona Lisa)"
"1164054523939184640","https://twitter.com/datGestruepp/status/1164054523939184640","21.08.2019","Ich fühle mich heute so abstrakt.","http://pbs.twimg.com/media/ECUrUSaXoAEAyf6.jpg","Tribut an Pablo Picasso"
"1164416912748634112","https://twitter.com/datGestruepp/status/1164416912748634112","22.08.2019","Guten Tag Herr Buchsbaum!","http://pbs.twimg.com/media/ECbcbL0WkAYlfJS.jpg","Benjamin Buxbaum (Darkwing Duck, Disney)"
"1164779299494387712","https://twitter.com/datGestruepp/status/1164779299494387712","23.08.2019","Ach, sie mögen lieber Milch?! Oh. Das ist jetzt.... Ähm... ","http://pbs.twimg.com/media/ECg3ORuWkAIOMTY.jpg","Leon, der Profi"
"1165141688047661059","https://twitter.com/datGestruepp/status/1165141688047661059","24.08.2019","Hübscher Schal. Strüppi hat auch so einen.","http://pbs.twimg.com/media/ECjV_OdX4AInwGv.jpg","Der Kleine Prinz (Antoine de Saint-Exupéry)"
"1165504075233992706","https://twitter.com/datGestruepp/status/1165504075233992706","25.08.2019","Ja Erdbeeren finde ich auch voll lecker!","http://pbs.twimg.com/media/ECmiggoWsAAP3JM.jpg","Rosalie Erdbeer (Prinzessin Erdbeer)"
"1165866463787462656","https://twitter.com/datGestruepp/status/1165866463787462656","26.08.2019","Und sie drücken also nur Knöpfe?","http://pbs.twimg.com/media/ECqmeNdXoAE6K6M.jpg","eosAndy (@Eosandy auf Twitter)"
"1166228850944225281","https://twitter.com/datGestruepp/status/1166228850944225281","27.08.2019","So fühle ich mich immer ohne Kaffee!","http://pbs.twimg.com/media/EC1UomfWsAAH8_I.jpg","Strüppiversion von 'Die Beständigkeit der Erinnerung' oder 'Die zerrinnende Zeit' (Tribut an Salvador Dalí)"
"1166591240088870912","https://twitter.com/datGestruepp/status/1166591240088870912","28.08.2019","Was habt ihr vor??","http://pbs.twimg.com/media/EC9JvuVXUAAa_ZA.jpg","Max und Moritz (Wilhelm Busch)"
"1166953626578890753","https://twitter.com/datGestruepp/status/1166953626578890753","29.08.2019","Ääähm....","http://pbs.twimg.com/media/EC9KD4ZWsAAuWxw.jpg","Venom (Spiderman, Marvel)"
"1167316015371423744","https://twitter.com/datGestruepp/status/1167316015371423744","30.08.2019","Ich mag dich!","http://pbs.twimg.com/media/EC9LfsHXoAA_TZN.jpg","Klaus Dieter (Löwenzahn)"
"1167678402398048257","https://twitter.com/datGestruepp/status/1167678402398048257","31.08.2019","Wie sind sie da rein gekommen? Und wie spricht man dieses chtu... chutull.... chtuhull.... aaaah!","http://pbs.twimg.com/media/EC_0HUWW4AEx0qa.jpg","Cthulhu (H.P.Lovecraft)"
"1168040791802990592","https://twitter.com/datGestruepp/status/1168040791802990592","01.09.2019","Willkommen auf der Erde!","http://pbs.twimg.com/media/EDHkJt0WwAA_4QM.jpg","Spock (Star Trek)"
"1168403179492372480","https://twitter.com/datGestruepp/status/1168403179492372480","02.09.2019","Möchten sie eine Gabel zu ihrem Kaffee?","http://pbs.twimg.com/media/EDIzjbSXYAErRis.jpg","Arielle die Meerjungfrau (Arielle, Disney)"
"1168765567555264512","https://twitter.com/datGestruepp/status/1168765567555264512","03.09.2019","Faszinierend!","http://pbs.twimg.com/media/EDPfIsjWwAUbYUw.jpg","Severus Snape (Harry Potter, J.K.Rowling, Buch)"
"1169127956020547584","https://twitter.com/datGestruepp/status/1169127956020547584","04.09.2019","Nein ich bin keine Miezekatze.","http://pbs.twimg.com/media/EDUEyPzXkAAdxpA.jpg","Tweety (Looney Tunes)"
"1169490344351682561","https://twitter.com/datGestruepp/status/1169490344351682561","05.09.2019","Zeigst du mir wie man so einen schönen Schmollmund bekommt? 😚","http://pbs.twimg.com/media/EDe3yPlW4AE_2YX.jpg","Ella (@EllaMirelle auf Twitter)"
"1169852732448104448","https://twitter.com/datGestruepp/status/1169852732448104448","06.09.2019","Heißt das, ich darf den Kaffee jetzt trinken?","http://pbs.twimg.com/media/EDcsf1FWsAEsXAc.jpg","Ostberliner Ampelmännchen"
"1170215118778458112","https://twitter.com/datGestruepp/status/1170215118778458112","07.09.2019","Ach sie sind der, der immer eine Idee hat?","http://pbs.twimg.com/media/EDe45RJX4AAJ1G2.jpg","Wickie (Wickie und die starken Männer)"
"1170577506719584256","https://twitter.com/datGestruepp/status/1170577506719584256","08.09.2019","Nawwww! Wie bist du denn da rein gekommen?","http://pbs.twimg.com/media/EDkHWuSW4AEGWLd.jpg","Myrapla (Pokemon, Game)"
"1170939895306752000","https://twitter.com/datGestruepp/status/1170939895306752000","09.09.2019","Wer...? Was...?","http://pbs.twimg.com/media/EDnwKIPXkAAV4FT.jpg","Metroid Larve (Metroid, Nintendo, Game)"
"1171302283121836033","https://twitter.com/datGestruepp/status/1171302283121836033","10.09.2019","Och! Dich habe ich ja lange nicht gesehen!","http://pbs.twimg.com/media/EDwz3YtU4AAEfGF.jpg","Chibi Maruko Chan (Manga-Serie)"
"1171664670605942787","https://twitter.com/datGestruepp/status/1171664670605942787","11.09.2019","Eene meene Moll, der Kaffee sei wieder voll! Hex hex!","http://pbs.twimg.com/media/ED2sQP2X4AA50cZ.jpg","Bibi Blocksberg (Zeichentrick)"
"1172027057670447105","https://twitter.com/datGestruepp/status/1172027057670447105","12.09.2019","Ich hab auch was grünes an. Darf ich sie jetzt retten?","http://pbs.twimg.com/media/ED8ZPNyX4AAzdKh.jpg","Prinzessin Zelda (Legend of Zelda, Nintendo, Game)"
"1172389445661810688","https://twitter.com/datGestruepp/status/1172389445661810688","13.09.2019","Nat!","http://pbs.twimg.com/media/EEDREGYX4AEkOvq.jpg","Ente (Sendung mit der Maus, WDR)"
"1172751833359704064","https://twitter.com/datGestruepp/status/1172751833359704064","14.09.2019","Nun...","http://pbs.twimg.com/media/EEDUPxpWsAAiBXX.jpg","Möwe (Findet Nemo, Pixar)"
"1173114222256869376","https://twitter.com/datGestruepp/status/1173114222256869376","15.09.2019","Was ist diese Box von diesem Schrödinger?","http://pbs.twimg.com/media/EELQcy2XkAAZYzD.jpg","Schrödingers Katze (Tribut an Erwin Schrödinger)"
"1173476609413779456","https://twitter.com/datGestruepp/status/1173476609413779456","16.09.2019","Ein Kesselchen Kaffee?","http://pbs.twimg.com/media/EELRyenXkAET2nY.jpg","Miraculix (Asterix & Obelix)"
"1173838996461375488","https://twitter.com/datGestruepp/status/1173838996461375488","17.09.2019","Ähmmm....","http://pbs.twimg.com/media/EEVzwF5XYAA7dgt.jpg","Ghostface (Scream)"
"1174201385782370304","https://twitter.com/datGestruepp/status/1174201385782370304","18.09.2019","Ouuu... ich dachte du wärst so ein Automat. Ach je. Zeit für einen","http://pbs.twimg.com/media/EEac50HWkAYcCYf.jpg","Flipper der Delfin"
"1174563773056598016","https://twitter.com/datGestruepp/status/1174563773056598016","19.09.2019","Das Kaffee. Kaffee lecker! Kaffee machen wach!","http://pbs.twimg.com/media/EEfALmYXYAEZshf.jpg","Frankensteins Monster"
"1174926160477728768","https://twitter.com/datGestruepp/status/1174926160477728768","20.09.2019","Der Kaffee hat gesagt ich soll ihn trinken!","http://pbs.twimg.com/media/EEminc3WwAAVsmK.jpg","Alice (Alice im Wunderland, Disney)"
"1175288548313858048","https://twitter.com/datGestruepp/status/1175288548313858048","21.09.2019","Ich möchte aber kein Spiel spielen. Ich möchte nur den Kaffee trinken.","http://pbs.twimg.com/media/EEmjbjlXUAMwOgE.jpg","Billy the Puppet (Saw)"
"1175650936678694912","https://twitter.com/datGestruepp/status/1175650936678694912","22.09.2019","Sie sind also ein Kapitän?","http://pbs.twimg.com/media/EEukqI6XsAAHCiK.jpg","Käpt'n Haddock (Tim und Struppi, Hérgé)"
"1176013323311042560","https://twitter.com/datGestruepp/status/1176013323311042560","23.09.2019","Warum haben Sie so große Hände?","http://pbs.twimg.com/media/EExSiKSX4AYw6yd.jpg","(böser) Wolf (Rotkäppchen)"
"1176375717132529665","https://twitter.com/datGestruepp/status/1176375717132529665","24.09.2019","♥️","http://pbs.twimg.com/media/EFGZMH6WkAEoXbj.jpg","Ferkel (Winnie Puuh)"
"1176738100401360899","https://twitter.com/datGestruepp/status/1176738100401360899","25.09.2019","Möchtest du aus meinem Becherchen trinken?","http://pbs.twimg.com/media/EFGZYi0WkAEzuD7.jpg","Froschkönig"
"1177100487520399360","https://twitter.com/datGestruepp/status/1177100487520399360","26.09.2019","Ähhmmmm... bisschen Öl?","http://pbs.twimg.com/media/EFKqcWcXoAIN-P1.jpg","Cyberman (Doctor Who)"
"1177462874941382656","https://twitter.com/datGestruepp/status/1177462874941382656","27.09.2019","Darf ich auch mal? Gnihihi.","http://pbs.twimg.com/media/EFKrSLyXUAEJ_IQ.jpg","Absolem (Alice im Wunderland)"
"1177825264241385472","https://twitter.com/datGestruepp/status/1177825264241385472","28.09.2019","Mächtig gewaltig Egon!","http://pbs.twimg.com/media/EFK6Js2W4AEED-f.jpg","Egon Olsen (Olsenbande, Film)"
"1178187650450124801","https://twitter.com/datGestruepp/status/1178187650450124801","29.09.2019","Oh Kacke!","http://pbs.twimg.com/media/EFTZvYQX4AEfZf7.jpg","Zeichen für Die Stille/Beichtpriester (Dr. Who)"
"1178550039586562048","https://twitter.com/datGestruepp/status/1178550039586562048","30.09.2019","Ähm... Tag auch?","http://pbs.twimg.com/media/EFVEWgKXoAE8ofm.jpg","Sam der Adler (Muppet Show)"
"1178912426814660608","https://twitter.com/datGestruepp/status/1178912426814660608","01.10.2019","Junger Meister! ❤️","http://pbs.twimg.com/media/EFVFQqCX4AAn3S3.jpg","Urzah (der dunkle Kristall)"
"1179274942820564992","https://twitter.com/datGestruepp/status/1179274942820564992","02.10.2019","Ein Tässchen Sägemehl?","http://pbs.twimg.com/media/EFVshe6XsAEzK-W.jpg","Pinocchio"
"1179637203133243392","https://twitter.com/datGestruepp/status/1179637203133243392","03.10.2019","Sie wollen WAS in meinen Kaffee tun???","http://pbs.twimg.com/media/EFf6J_kXYAAzo76.jpg","Rémi (Ratatouille, Pixar)"
"1179999589778284544","https://twitter.com/datGestruepp/status/1179999589778284544","04.10.2019","Ach, und den Apfel hat sie ihnen einfach geschenkt? Wie nett!","http://pbs.twimg.com/media/EFktrrrX0AAjrYF.jpg","Schneewittchen"
"1180361978482573312","https://twitter.com/datGestruepp/status/1180361978482573312","05.10.2019","Oh. Ist der Kaffee zu stark?","http://pbs.twimg.com/media/EFqO2eQWsAInc6m.jpg","Tassilo (Schöne und das Biest, Disney)"
"1180724365832253440","https://twitter.com/datGestruepp/status/1180724365832253440","06.10.2019","Och, so unheimlich siehst du gar nicht aus.","http://pbs.twimg.com/media/EFvF2h5XYAA1nSA.jpg","Six (Little Nightmares, Tarsier Studios, Game)"
"1181086755337801728","https://twitter.com/datGestruepp/status/1181086755337801728","07.10.2019","Son-Wer?","http://pbs.twimg.com/media/EF0pHNRWsAAlHqQ.jpg","Son-Goku (Dragonball, Akira Toriyama, Anime, Manga)"
"1181449141555093505","https://twitter.com/datGestruepp/status/1181449141555093505","08.10.2019","Ähm... und warum soll ich jetzt für meinen eigenen Kaffee bezahlen?","http://pbs.twimg.com/media/EF8PoLLXUAAeoIa.jpg","Mr. Krabs (SpongeBob)"
"1181811530746204160","https://twitter.com/datGestruepp/status/1181811530746204160","09.10.2019","Der gute Kaffee!!!!","http://pbs.twimg.com/media/EGS601DXoAA1abA.jpg","Septa Unella (Game of Thrones, G.R.R.Martin, Buch)"
"1182173918859276289","https://twitter.com/datGestruepp/status/1182173918859276289","10.10.2019","Iiiiihh!","http://pbs.twimg.com/media/EGTbuQJU4AAnBJp.jpg","Schleimgeist/Slimer (Ghostbusters)"
"1182536305177235457","https://twitter.com/datGestruepp/status/1182536305177235457","11.10.2019","Von denen gibt’s noch mehr stimmt?","http://pbs.twimg.com/media/EGTdjYnU4AARK7D.jpg","Dragonball (Dragonball, Akira Toriyama, Anime, Manga)"
"1182898692770021376","https://twitter.com/datGestruepp/status/1182898692770021376","12.10.2019","Wie?!?","http://pbs.twimg.com/media/EGbMHCxWwAA89tx.jpg","Excalibur"
"1183261082623889409","https://twitter.com/datGestruepp/status/1183261082623889409","13.10.2019","Und was liefern Sie so aus?","http://pbs.twimg.com/media/EGlHwSzXYAAksQF.jpg","Kiki und Jiji (Kikis kleiner Lieferservice, Studio Ghibli, Anime)"
"1183623469705154560","https://twitter.com/datGestruepp/status/1183623469705154560","14.10.2019","Och nö!","http://pbs.twimg.com/media/EGnhy3DXkAA7QtH.jpg","Po (Teletubbies)"
"1183985856958193666","https://twitter.com/datGestruepp/status/1183985856958193666","15.10.2019","Und wann werden die jetzt zu Talern?","http://pbs.twimg.com/media/EGqbonhWwAAcKVR.jpg","Sternentaler"
"1184348245742346240","https://twitter.com/datGestruepp/status/1184348245742346240","16.10.2019","Und wo kommt da jetzt das Garn raus?","http://pbs.twimg.com/media/EGqcoD2W4AEC6tE.jpg","Malefiz (Dornröschen, Disney)"
"1184710633096237056","https://twitter.com/datGestruepp/status/1184710633096237056","17.10.2019","Oha!","http://pbs.twimg.com/media/EGyavwaW4AAMF0t.jpg","Nebulak (Pokemon, Game)"
"1185073021217734656","https://twitter.com/datGestruepp/status/1185073021217734656","18.10.2019","So viel Power!","http://pbs.twimg.com/media/EG15lURWsAEmGdx.jpg","Bubbles (The Power Puff Girls)"
"1185435407837794304","https://twitter.com/datGestruepp/status/1185435407837794304","19.10.2019","vielleicht hätte ich etwas mehr Kaffee aufsetzen sollen.","http://pbs.twimg.com/media/EG2VDVlXkAQ14iH.jpg","Die drei Siedler (Siedler, Blue Byte, Game)"
"1185797796701409280","https://twitter.com/datGestruepp/status/1185797796701409280","20.10.2019","Awwww! #kritzelschuh ääähhh","http://pbs.twimg.com/media/EG2V5f-X4AEDG3l.jpg","EVE (WALL-E, Pixar)"
"1186160183581593600","https://twitter.com/datGestruepp/status/1186160183581593600","21.10.2019","Irgendwas ist anders als sonst.","http://pbs.twimg.com/media/EHBTHxbXUAEuDX8.jpg","Waschbär mit Strüppi (@Yvraldis auf Twitter)"
"1186522572747366401","https://twitter.com/datGestruepp/status/1186522572747366401","22.10.2019","Ach!","http://pbs.twimg.com/media/EHJmRnzX4AAM8TJ.jpg","Maulwurfn (Puppe von René Marik)"
"1186884959660888065","https://twitter.com/datGestruepp/status/1186884959660888065","23.10.2019","Jaja, ist bald Halloween.","http://pbs.twimg.com/media/EHPT-fGX4AAK25I.jpg","Irgendeine Mumie"
"1187247348616847360","https://twitter.com/datGestruepp/status/1187247348616847360","24.10.2019","Ach und sie können jeder Mensch sein den sie wollen? Praktisch!","http://pbs.twimg.com/media/EHUCVdwWsAAbW4Q.jpg","Mystique (X-Man, Marvel)"
"1187609734926360577","https://twitter.com/datGestruepp/status/1187609734926360577","25.10.2019","Und das tut nicht weh? ","http://pbs.twimg.com/media/EHUDES2X4AAGgpC.jpg","Pinhead (Hellraiser, Horrorfilm)"
"1187972123257495552","https://twitter.com/datGestruepp/status/1187972123257495552","26.10.2019","Mir ist so anders.","http://pbs.twimg.com/media/EHa8ZXlXYAIsJE6.jpg","Coraline"
"1188350663316660224","https://twitter.com/datGestruepp/status/1188350663316660224","27.10.2019","Super Trooper! Ahahahahaa! Sie verstehen! Haha!","http://pbs.twimg.com/media/EH3engXX0AEmMUp.jpg","Stormtrooper (Star Wars)"
"1188711999762399234","https://twitter.com/datGestruepp/status/1188711999762399234","28.10.2019","Komischer Name... Chucky...","http://pbs.twimg.com/media/EHa-IHSX4AE7E9Q.jpg","Chucky die Mörderpuppe (Horrorfilm)"
"1189074387795771394","https://twitter.com/datGestruepp/status/1189074387795771394","29.10.2019","Jaaaaa, ich hab mich voooll erschreckt! Oh! Wir gruselt es mir! *seufz*","http://pbs.twimg.com/media/EHkGEgmWkAEIqzM.jpg","Casper (Casper - Der freundliche Geist, Zeichentrick)"
"1189436775556505601","https://twitter.com/datGestruepp/status/1189436775556505601","30.10.2019","Oookaaay...","http://pbs.twimg.com/media/EHuzdeTW4AA9cuh.jpg","Truhe (Scheibenwelt, Terry Pratchett, Buch)"
"1189799162474303488","https://twitter.com/datGestruepp/status/1189799162474303488","31.10.2019","Danke Strüppi!  Mensch, wo hab ich heute nur meinen Kopf!?","http://pbs.twimg.com/media/EHu0HFBW4AIkPlN.jpg","Suse als der Kopflose Reiter (Halloween)"
"1190161549471694849","https://twitter.com/datGestruepp/status/1190161549471694849","01.11.2019","Singen sie jetzt auch? Und warum sieht ihr Auge so komisch aus?","http://pbs.twimg.com/media/EH4GEYEWoAE8V4P.jpg","Das Phantom (Das Phantom der Oper, Musical)"
"1190523937547079680","https://twitter.com/datGestruepp/status/1190523937547079680","02.11.2019","Warum machst du Glitzer in meinen Kaffee?","http://pbs.twimg.com/media/EH4Gkw_W4AAw7hg.jpg","Little Misfortune (Little Misfortune, Killmonday Games, Game)"
"1190886325555253248","https://twitter.com/datGestruepp/status/1190886325555253248","03.11.2019","Ach, praktisch so unsichtbare Extraarme. ","http://pbs.twimg.com/media/EH_thhdX0AAtNJV.jpg","Lucy/Nyu (Elfen Lied, Lynn Okamoto, Anime)"
"1191248713991233536","https://twitter.com/datGestruepp/status/1191248713991233536","04.11.2019","Ähmmmm....","http://pbs.twimg.com/media/EH_t3kDXUAEqec4.jpg","Xenomorph (Alien)"
"1191611102431531008","https://twitter.com/datGestruepp/status/1191611102431531008","05.11.2019","Och...","http://pbs.twimg.com/media/EIKekL2XkAAc91l.jpg","Grün-Tentakel (Day of the Tentacle und Maniac Mansion, LucasArts, Game)"
"1191973488946536448","https://twitter.com/datGestruepp/status/1191973488946536448","06.11.2019","Langsam gewöhne ich mich dran.","http://pbs.twimg.com/media/EIKe8woXkAAFGm5.jpg","Digda (Pokemon, Game)"
"1192335876690309120","https://twitter.com/datGestruepp/status/1192335876690309120","07.11.2019","Ich möchte meine Stimme bitte behalten. Danke.","http://pbs.twimg.com/media/EIRT9wEWkAMREdp.jpg","Hexe Ursula (Arielle, Disney)"
"1192698265243934721","https://twitter.com/datGestruepp/status/1192698265243934721","08.11.2019","Okay der Herr.","http://pbs.twimg.com/media/EIRUk5UX0AEsd0V.jpg","Herr Kaffee (@Kaffeegaming auf Twitter)"
"1193060652748869634","https://twitter.com/datGestruepp/status/1193060652748869634","09.11.2019","Hübsche Haarfarbe!","http://pbs.twimg.com/media/EIcrtVGWkAA2g7L.jpg","Leeloo Minai Lekatariba-Lamina-Tchai Ekbat De Sebat (Das fünfte Element)"
"1193424500412563456","https://twitter.com/datGestruepp/status/1193424500412563456","10.11.2019","Hallo der Herr!","http://pbs.twimg.com/media/EI_lQLOW4AAXeqJ.jpg","Professor Hershel Layton (Professor Layton, Level 5, Game)"
"1193785428152766464","https://twitter.com/datGestruepp/status/1193785428152766464","11.11.2019","Na? Alle Nähte fest? #kritzelkaffe","https://pbs.twimg.com/media/EInfhB0XsAQA-Uv.jpg","Sally (Nightmare before Christmas, Tim Burton)"
"1194147816647479296","https://twitter.com/datGestruepp/status/1194147816647479296","12.11.2019","Jaaaa, aber ich mag meine Haar gerade so wie sie sind.","http://pbs.twimg.com/media/EIuQGpaX0AApx3C.jpg","Edward (Mit den Scherenhänden, Tim Burton)"
"1194510205456805888","https://twitter.com/datGestruepp/status/1194510205456805888","13.11.2019","Hallo Tiffi!","http://pbs.twimg.com/media/EI4NfjyXUAIS6fB.jpg","Tiffy (Sesamstraße)"
"1194872591804092416","https://twitter.com/datGestruepp/status/1194872591804092416","14.11.2019","Endlich! Mein Brief!","http://pbs.twimg.com/media/EI4N3_oWkAIm74G.jpg","Hedwig (Harry Potter, J.K.Rowling, Buch)"
"1195234981804531712","https://twitter.com/datGestruepp/status/1195234981804531712","15.11.2019","Schon wieder ein Pokemon!","http://pbs.twimg.com/media/EJAALfsWoAACF95.jpg","Voltilamm (Pokemon, Game)"
"1195597367656865792","https://twitter.com/datGestruepp/status/1195597367656865792","16.11.2019","Aha! Sie wollen also Pirat werden?","http://pbs.twimg.com/media/EJMLx4OX0AAgfnn.jpg","Guybrush Threepwood (Monkey Island, LucasArts, Game)"
"1195959755791044608","https://twitter.com/datGestruepp/status/1195959755791044608","17.11.2019","Ich mag auch Bäume!","http://pbs.twimg.com/media/EJbsrGwWoAERADu.jpg","Idefix (Asterix & Obelix)"
"1196322144919179264","https://twitter.com/datGestruepp/status/1196322144919179264","18.11.2019","Ein Troll?? EIN TROLL??!","http://pbs.twimg.com/media/EJRvKBgXYAAyW4a.jpg","Zaubertroll (Spielzeug der 90er)"
"1196684531463598080","https://twitter.com/datGestruepp/status/1196684531463598080","19.11.2019","Boah ne! Nicht diese Schmalzlocke!","http://pbs.twimg.com/media/EJRvwkFXUAESov6.jpg","Gaston (Die Schöne und das Biest, Disney)"
"1197046920880914434","https://twitter.com/datGestruepp/status/1197046920880914434","20.11.2019","Ach. Und sie sind jetzt Pirat?","http://pbs.twimg.com/media/EJbrZ69XUAEhG4-.jpg","Ruffy/Luffy (One Piece, Eiichirō Oda, Manga, Anime)"
"1197409308343853056","https://twitter.com/datGestruepp/status/1197409308343853056","21.11.2019","Wow! Und ich kann mir jetzt was Wünschen!","http://pbs.twimg.com/media/EJbsMOUWkAAS1st.jpg","Dschinni (Aladdin, Disney)"
"1197771696402358273","https://twitter.com/datGestruepp/status/1197771696402358273","22.11.2019","Und welches ist dein Lieblingspokemon?","http://pbs.twimg.com/media/EJlUsmcXUAYlfNX.jpg","Phunk (@PhunkRoyal auf Twitter)"
"1198134082816925696","https://twitter.com/datGestruepp/status/1198134082816925696","23.11.2019","Also ich hätt jetzt schon gerne Schokolade.","http://pbs.twimg.com/media/EJlVDCoW4AI3QdQ.jpg","Willy Wonka (Charlie und die Schokoladenfabrik, Roald Dahl, Tim Burton)"
"1198496470472830977","https://twitter.com/datGestruepp/status/1198496470472830977","24.11.2019","Ach guck!","http://pbs.twimg.com/media/EJlVa-1WsAETtQ_.jpg","Doozer (Die Fraggles)"
"1198858858254331907","https://twitter.com/datGestruepp/status/1198858858254331907","25.11.2019","Aber Zaubern können sie schon oder?","http://pbs.twimg.com/media/EJ4xiL2XUAIoiAO.jpg","Rincewind der Zauberer (Scheibenwelt, Terry Pratchett, Buch)"
"1199221247734734850","https://twitter.com/datGestruepp/status/1199221247734734850","26.11.2019","Nein ich hab keinen Hund. Warum fragen sie mich das? Sie sind gruselig!","http://pbs.twimg.com/media/EJ7e16tXkAIpYHu.jpg","Cruella De Vil (101 Dalmatiner, Disney)"
"1199583635646451712","https://twitter.com/datGestruepp/status/1199583635646451712","27.11.2019","Deine Augen sind auch nur ganz wenig gruselig.","http://pbs.twimg.com/media/EKE79YxWoAEn2Wv.jpg","Wanda (Cosmo & Wanda - Wenn Elfen helfen, Nickelodeon, Zeichentrick)"
